{"$defs":{"digest":{"pattern":"^[a-f0-9]{64}$","type":"string"},"document_schema":{"additionalProperties":false,"properties":{"id":{"const":"https://agent-ops.ru/schemas/foundation_human_decision.schema.json"},"media_type":{"const":"application/schema+json"},"sha256":{"$ref":"#/$defs/digest"},"version":{"const":"1.0.0"}},"required":["id","version","sha256","media_type"],"type":"object"},"ref":{"additionalProperties":false,"properties":{"id":{"maxLength":128,"minLength":1,"type":"string"},"kind":{"enum":["project","environment","owner","evidence_record","operational_intent","human_decision"]},"namespace":{"maxLength":512,"minLength":8,"type":"string"},"version":{"maxLength":32,"pattern":"^(0|[1-9][0-9]*)\\.(0|[1-9][0-9]*)\\.(0|[1-9][0-9]*)$","type":"string"}},"required":["kind","namespace","id","version"],"type":"object"},"scope":{"additionalProperties":false,"properties":{"actor_role":{"maxLength":128,"minLength":1,"type":"string"},"blocked_action":{"maxLength":128,"minLength":1,"type":"string"},"environment_ref":{"$ref":"#/$defs/ref"},"intent_ref":{"$ref":"#/$defs/ref"},"project_ref":{"$ref":"#/$defs/ref"},"transition_id":{"maxLength":128,"minLength":1,"type":"string"}},"required":["project_ref","intent_ref","transition_id","blocked_action","actor_role"],"type":"object"}},"$id":"https://agent-ops.ru/schemas/foundation_human_decision.schema.json","$schema":"https://json-schema.org/draft/2020-12/schema","additionalProperties":false,"properties":{"actor_role":{"maxLength":128,"minLength":1,"type":"string"},"authority_scope":{"$ref":"#/$defs/scope"},"blocked_action":{"maxLength":128,"minLength":1,"type":"string"},"decision":{"enum":["approve","deny"]},"document_schema":{"$ref":"#/$defs/document_schema"},"expires_at":{"format":"date-time","type":"string"},"format_version":{"const":"1.0.0"},"intent_ref":{"$ref":"#/$defs/ref"},"issued_at":{"format":"date-time","type":"string"},"issuer_attestation_ref":{"$ref":"#/$defs/ref"},"not_before":{"format":"date-time","type":"string"},"owner_ref":{"$ref":"#/$defs/ref"},"principal_ref":{"$ref":"#/$defs/ref"},"ref":{"$ref":"#/$defs/ref"},"revocation_ref":{"$ref":"#/$defs/ref"},"transition_id":{"maxLength":128,"minLength":1,"type":"string"}},"required":["format_version","document_schema","ref","owner_ref","intent_ref","transition_id","principal_ref","issuer_attestation_ref","actor_role","authority_scope","blocked_action","decision","issued_at","not_before","expires_at"],"title":"Gitinsky Foundation Human Decision Authored Document","type":"object"}
